,title
4153,GAR-for-2203240040002823
4154,Cluster Configuration changed with new Hardware Types
4155,[Very URGENT]Some Folder is deleted from Prod Folder Repo
4156,"when the cluster is getting restart, 1 node is getting skipped due to slow node"
4157,Issue in table creation from Rstudio using saveAsTable through databricks connect
4158,Latency issue while running notebooks
4159, KPI Vulnerability for malware in Databricks cluster with runtime 6.4
4160,Permissions bug in webhooks API
4161,Elevated job execution time on E2 workspace
4162,CSS-ARR-S500-SR#2203230030000992-Need help to enable feature to create private workspace in subscription  using terraform
4163,2203240030000252 
4164,A problem against Databrick service
4165,A problem against Databrick service
4166, Issue in launching Data bricks cluster 
4167,Cluster Not starting
4168,databricks account password reset
4169,2203210030000190 
4170,2203210030000190 
4171,2203110030001083
4172,not able to connect Mule with Databricks cluster
4173,2203220040004731 - geine
4174,[ARR] [Sev B] SR-2203230030002684 Containers not being added during Databricks cluster upsize
4175,Issue with . in column names using Change Data Feed
4176,unable to add bitbucket repo in Databricks
4177,Unable to connect from Tableau to Databricks in Azure
4178,Databricks can't find getArgument() function in Spark SQL when executed as an ADF Notebook Activity
4179,please help to recovery the folder under shared
4180,2203230030002716
4181,SAMLv2 Databricks metadata file
4182,[ARR][AT & T][2203230040006929 ] Production job was  stuck 
4183,Request to enable Unity Catalog
4184,Job in E2 is taking much longer compared to run in PVC
4185,Scopes reach max limit
4186,Account Console details updation
4187,Cluster sat at high utilization for several hours with light load
4188,Deleted Notebooks recovery
4189,newly needing to add zscaler certs to databricks cluster to have job run successfully 
4190,2203210040007860
4191,follow-up for 00138571
4192,Cannot interact with external tables or storage 
4193,ARR - Canadian Tire - 2203040040004381 - Connectivity to AzureSQL failing with cert error
4194,Error when loading R package
4195,"Read taking way too long given data size, resulting in ExecutorLostException"
4196,ARR - 2202110040007666 - Connectivity from Power BI to Databricks
4197,Can't connect to synapse from the Databricks
4198,Sparklyr and createOrReplaceTempView
4199,129372011637026 - 42c0910c-ba8d-4218-96f2-e8bbcfdb8dc0 - 2203040040004381
4200,create job from json file
4201,Libraries are not properly uninstalled from clusters on v9.x and 10.x
4202,2203020010003574SF || Intermitent Delta Table Create or Replace Failures
4203,Unity Catalog can't Unlink Metastore from a Workspace
4204,There is a pipeline on ADF which has databricks notebooks that used to run for 6 hours now for even a
4205,There is a pipeline on ADF which has databricks notebooks that used to run for 6 hours now for even a 
4206,ARR: Question for Canada Region: SR 2203230040005538 
4207,ARR| follow up - 00132700 |
4208,error when we are reading a delta table
4209,Logging inference from real-time MLflow serving clusters
4210,uninstalled libraries continue to be installed on cluster startup
4211,Metrics unavailable for an old Databricks cluster
4212,schema issue in databricks audit logs for specific day
4213,Enable audit logging in PVC
4214,UI doesn't allow Auth Flows
4215,Not able to start a cluster in ml-us-dev workspace
4216,NTH_VALUE func diff (Scala vs SQL)
4217,Cluster start issues in new workpace
4218,ARR - 2203150040007303
4219,User unable to refresh Extract on Tableau Online with a Databricks connection
4220,Blob mounted with SAS token without DELETE permission fails to PUT files 
4221,Databricks internal dbfs tables migration from one workspace to another workspace in different subscription
4222,ARR | SQL endpoint failing to start | 2203180040002303 | JNJ
4223,CSS-ARR-S500-SR#2203160030001255-Admin Access issue for the Workspace
4224,Jobs failing with library not being installed on dataclusters
4225,what is the best practice to monitor logs
4226,Cluster regularly fails due to Spark exception received from driver. Driver down
4227,Cant Add New  Instance Profile
4228,Suppress logging during start up of clusters
4229,Central hive metastore version upgrade
4230,Download files from S3 bucket in Dev
4231,Fixing Databricks Job (Specific TImeframe)
4232,Fixing Databricks Job (Cross-Visitation)
4233,Abnormal beahviour on cluster
4234,Error/slow  establishing connection/fetching data from SQL Endpoint
4235,Not able to access MYSQL database from SQL endpoint on Databricks cluster
4236,Command stuck on levi-dsp-preprod -  No alive workers
4237,Fixed size clusters are showing as 0 in the UI
4238,Get Last-accessed/ run for a table
4239,A task can't open Spark UI
4240,Insight Dev work space performance is very low
4241,[com.microsoft.sqlserver.jdbc.SQLServerException: Incorrect syntax near '<'.] when run spark_df = spark.read 
4242,Reset password option missing in admin console
4243,Showing service principal display name instead of application id in UI
4244,Cost Analysis  & Advisor Recommendations
4245,Rerouting cluster logs to adls gen2
4246,Not all users present in 'users' Databricks group
4247,dataset refresh failing
4248,credential pass through authentication
4249,Follow up of( 00137929) I get an error when doing division using DirectQuery to Azure Databricks.
4250,Did API 2.1 support cluster policy id?
4251,Follow up of(00137745) Copy Activity to Delta Lake
4252,cluster is in pending
4253,Help to check the backend logs 
4254,Export or clone all config from one DBX workspace to new Workpac e
4255,CSS-SFMC-2203170040001201-ADB Cluster Hung
4256,CSS-ARR-S500-SR#2203210030000831-Need to migrate it to some other workspace
4257,intermittently gets 'The INSERT statement conflicted with the FOREIGN KEY constraint' error
4258,Job failure
4259,weird Spark behaviour
4260,ARR | 2203150040006011 | mlflow.xgboost.load(xgboost model) returned __init__() got an unexpected keyword argument 'tensor-spec' error
4261,Not able to install R pakages 
4262,"ARR | 2203220030001844 | In workspace restore process, CSET does not work properly"
4263,dataset refresh failing
4264,Improper scaling - Endpoint Databricks SQL
4265,2985  - g - ARR - providence - Unable to connect to synapse from Databricks
4266,2203030010002530
4267,We can't upgrade to current runtime version 10.x
4268,We can't upgrade to current runtime version 10.x
4269,How to enable custom logging on worker to s3 bucket
4270,Jobs failing - Time out
4271,Recover deleted workspace
4272,Automated Ci/CD pipeline update into Dbx Repo  requires personal  account signed into Gitlab
4273,Notification Emails not being sent
4274,I keep getting SparkException: Job aborted.
4275,idempotency_token not behaving as described in Jobs 2.0 API Docs
4276,Need some info regarding datalake time travel
4277,Not receiving email notifications on job runs
4278,Job failing with com.amazonaws.SdkClientException: Unable to execute HTTP request: Timeout waiting for connection from pool
4279,Please increase workspace defined job quota from 1200 to 1500
4280,MLflow Experiment: RestException: FEATURE_DISABLED: Creation of experiments outside the workspace is not enabled. 
4281,increase job limit 
4282,ARR: Incorrect results.exception with SQL 'WHERE EXISTS' clause: SR2203180040004518 
4283,Ganglia UI is somewhat broken
4284,80809 - g - ARR - PepsiCo - Cannot access ADLS
4285,ARR | AT&T | 2203100040006559 | Workspace connectivity to storage account fails with HTTP Error -1TTP 
4286,Azure VM Extension Error
4287,Stability issues with Spark sessions
4288,Databricks non-prod clusters not starting
4289,SELF_BOOTSTRAP_FAILURE(SUCCESS)
4290,Error spinning up a Databricks cluster or job cluster
4291,Not able to reset password
4292,Unable to  log OUT or change password on Accounts Console
4293,Help with cross account role for accessing bucket in external vendor
4294,Unable to connect cross account access to s3
4295,Lost worker errors causing Databricks job to never finish
4296,Single Node Cluster not starting
4297,Failure to access data in S3 Intelligent-Tiering Storage
4298,How do I use the REST API to provide a service principal access to an instance profile
4299,new ip address for whitelist
4300,take too much time to complete notebook
4301,Photon ran out of memory error while switching from DBFS to ADLS
4302,We have got an error: Insufficient Free Addresses In Subnet Failure
4303,Having s3 access denied errors in new workspace
4304,Databricks connect for DBR 10.4 LTS
4305,User did not receive workspace invite
4306,Cluster won't staring up affecting prod jobs
4307,Tag Databricks S3 objects
4308,Audit logs are stopped published to configured S3 buckets 
4309,2203090040006252 | Job Failure
4310,SHOW GRANT on table shows old deleted group 
4311,2203220040004731 GENIE
4312,Databricks Job Hanging Tasks
4313,SQL Endpoint not starting
4314,Feature Store package in Standard DBR
4315,2201310040000447
4316,Increase number of simultaneous Hive metastore connections
4317,SQL endpoint configured but getting 403 error - access denied on S3 bucket
4318,Ctrl + Enter in SQL editor for Data bricks SQL executes query twice
4319,ARR 2203140050000737 - Unable to run job from ADF into cluster
4320,Streaming cluster execution failed
4321,Jobs in Production and QA Databrciks are failing due to timeout error.
4322,Whitelist 44.198.103.215 in databricks
4323,When trying to create a workspace using terraform I get the error message...
4324,Assistance to understand VM utilization
4325,how to get a job by name usinng databricks api
4326,Create private workspace failed
4327,clusterAggressiveAutoscalingEnabled
4328,Databricks Cluster higher LTS version not working
4329,2203180040002303
4330,Databricks job is running slow and intermittently failing
4331,No SAS process attached. SAS process has terminated unexpectedly
4332,gpu utilisation tracking 
4333,Cluster event logs vs Log Analytics logs
4334,Streaming from shallow clone makes spark fail
4335,Accessing hive_metastore from SQL endpoints requires to be a workspace admin ?
4336,Plotly Mapbox plots are displayed
4337,Failed to update InstanceProfile while job cluster creating
4338,Could not create private workspace in azure databricks
4339,Databricks jobs hung condition for last 5 hours
4340,VM extensions
4341,2203210030000419
4342,Issues in viewing the MLFLOW Experiments from Databricks MLFlow UI
4343,Databricks to investigate an issue with an hourly ingestion job we have running on our live Databricks service
4344,Getting an error on spark.read.format('delta') command in databricks with cfx-dataquality-1 and Scala: 2.11 and Spark: 2.4.5
4345,Cluster event logs vs Log Analytics logs
4346,Getting an error on spark.read.format('delta') command in databricks with cfx-dataquality-1 and Scala: 2.11 and Spark: 2.4.5
4347,can't get partner connect tab 
4348,2203220030000505
4349,ARR | 2203170010000894 | init script with secret and scopes not working 
4350,2203180030000847 | The Nielsen Company | ARR
4351,Follow up of   00131426
4352,CSS-SR# 2203210030000844-Not able to view driver logs/Spark UI/Ganglia Metrics for ML Flow Cluster
4353,Runtime crashes unexpectedly and without explanation
4354,how to add service principal to 
4355,Create a key vault backup scope with a Service Principal
4356,9084 - ARR - Inspire Brands - .cache() not working as expected
4357,Issues saving spark udf applied dataframe as delta table
4358,2203030010002530
4359,Cannot authenticate to databricks cli
4360,2203180040005130  Autoscaling removed the node leads to execution failure
4361,Unable to access MLFlow artifact from notebook
4362,2203220060000118 
4363,2203220060000118 
4364,Databricks hive meta table permission
4365,[ARR] [Sev B] SR-2203210030001690 How_to_Mount_Azure_File_Share_to_Databricks
4366,Followup of SF ticket 00136678
4367,ARR | 2203220040000035 | java.lang.OutOfMemoryError even though increasing the cluster size
4368,Driver logs Error check your cluster UI to ensure that workers are registered and have sufficient resources.
4369,ARR | 2203220040000035 | java.lang.OutOfMemoryError even though increasing the cluster size
4370,ARR | 2203220040000035 | java.lang.OutOfMemoryError even though increasing the cluster size
4371,Spark Streaming Job Failure
4372,Python Notebook Exceptions not Showing
4373,400 response code from S3
4374,ARR| Query Aggregate summation results in zeros in SQL Endpoint- 2203080010000161 
4375,Databricks clusters taking hours to start
4376,Unable to see the actual table column names in AWS Glue
4377,"In-continue to 00128562, Autoloader takes 22 means to start the first batch"
4378,ARR: Advisory/DBR notebook failing due to hitting the limit 20MG output : SR2203210040006622 
4379,EDP Nonprod Env. is down.
4380,schema Merge Failure
4381,unclear error
4382,gar for 2203210030001444 
4383,ARR | Nuance |  2203180040005297 | Databricks Jobs taking too long post Databricks Runtime version upgrade from 7.3 to 10.2
4384,1866 - ARR - Safeway - Failed job
4385,CTAS statements running  pretty slowly
4386,Cluster terminated.Reason:Cloud provider launch failure
4387,job permissions
4388,Not found Url error when loading the model 
4389,Databricks s3 cross-account access error
4390,403 Error for Service Principal connecting to SQL endpoint
4391,Job Failure Debugging Assistance
4392,Daily optimize job failures
4393,2202280040007478
4394,Unable to use specific committers 
4395,service down
4396,Cluster not available while running the jobs
4397,2203180040005194 | Job Failure
4398,VPC Flow Log - ETL - Optimized write takes more than 16 min
4399,ARR- 2203110040003582
4400,Edit Pool configuration (autoscaling local storage)
4401,Getting error while trying to start the cluster : Instance was not reachable.
4402,Subnet Issue
4403,Spark SQL job aborted due to error reading parquet file
4404,2203160010002405 | Job Slowness
4405,[ARR] streaming from Kafka to ADLs gen2 error
4406,"Logs, monitoring, and ssh"
4407,Cannot broadcast the table that is larger than 8GB: 10 GB
4408,Databricks Cloud Provider Launch Failure
4409,Cluster temporarily unavailable
4410,The SQL Editor doesn't properly show the query status 
4411,Rstudio Cluster issues
4412,CSS ARR | 2203210030000403- MLFlow model image building is failing
4413,Inserting data from RC file to Delta file format is not working 
4414,Random Data Drop In Sales Xpopd Data Service
4415,Databricks account login - email
4416,Connect to SalesForce 
4417,ARR SevA: Issue with Fraud detection job's performance
4418,CRAN libraries unavailable (cran.microsoft.com)
4419,cmd get stuck in UI
4420,Aws insufficient instance capacity failure
4421,Databricks S3 Usage
4422,Cannot do time travel to older version of delta
4423,Docker containers and Instance Profile
4424,Problem reading Delta tables from Spark app
4425,Databricks portal not accessible
4426,Cannot create cluster in Databricks
4427,workspace restoration 
4428,take too much time to complete notebook
4429,2203210030000840 |  Shell MAHS | ARR SEV A
4430,Databricks: unresolved dependency: joda-time:joda-time:2.9.9: not found
4431,Performance issues with databricks 
4432,DBU usage logs are getting updated
4433,CSS-ARR-SR#2203170030001342-understand capacity requirements (current utilization and forecasted capacity in future)
4434,ARR-[REG:2203140030001959]Unable to start any cluster
4435,2203180030000847
4436,2203210030000474
4437,The output of the notebook is too large
4438,2203210030000474 | ARR | Delta schema is not updating properly for Json | Hiveloop Technology Private Limited
4439,CSS ARR | 2203070030000782 - drop table statetment not dropping the table from databricks job notebook
4440,CSS-SFMC-2203170040001201-ADB Cluster Hung
4441,[ARR][CSS][Request to enable Delta Live Tables on workspaces]
4442,Need to delete Databricks service that nobody has access to
4443,CSS-ARR-SR#2201070040001024-Follow up case | 00134733
4444,Getting Dataset refresh issue in Power BI dashboard
4445,Followup of SF ticket 00137008 
4446,Followup of SF ticket 00137735
4447,Usage Log Delivery
4448,[ARR] SR-2203160030001662 Job Failed
4449,[ARR] SR-2203200030000229 Best way to do ML model monitoring on databricks
4450,Job completed but hung
4451,billable usage logs hasn't been delivered since March 16
4452,Allocating cost based on Tags
4453,job failure/long running without change to job
4454,ARR-2203150040000688
4455,API regularly returns Error 104 during /dbfs/put
4456,Job run issue fails with large dataframe
4457,ARR | When trying to copy data from ADLS Gen2 to SQL DWH(Azure Synapse) we get the error with max char length issue 
4458,2203190010000171 Get Databricks account manager’s contact for cx
4459,Dropping and Creating Default Tables  from New Metastore
4460,ARR |  Gilead Sciences| Job aborted | SR: 2203190030000082 
4461,ARR | Repos Folder got accidentally deleted
4462,Query Failing with Null Pointer Exception
4463, 2203190030000090 -  GA - Databricks Notebooks are failing with Job aborted issue 'org.apache.spark.SparkException: Job aborted'
4464,Unable to launch cluster
4465,ExecutorLostFailure: Remote RPC Client Disassociated
4466,Follow up for 00138574 | ARR | Serv A 
4467,8573 - ARR - AshleyFurniture - Please enable dbutils.secrets.get for new workspace
4468,"ARR:Getting slow data transfer rate in March 2022, compare with Jan/Feb 2022:SR2203170040006912 "
4469,2203110040005117 - Issue connecting to ADO repo on user AD authentication
4470,ARR | Cluster failed due to driver unhealthy error - 2203150040007744
4471,Allowlisting databricks's nodes IP addresses with a third party API provider
4472,Databricks gapply function in R corrupts data with bigint datatype
4473,commands run dbutils but not some %sh commands
4474,"Error from Repos after select ""Agree and Pull"""
4475,Job failure due to stage failure: ShuffleMapStage 14
4476,errors are related to databricks sql connector
4477,EULA expired
4478,DBX jobs are failing when ADF is trying to install Maven adal4j.1.6.6 package. 
4479,AWS_INSUFFICIENT_FREE_ADDRESSES_IN_SUBNET_FAILURE and other errors
4480,Databricks Job Performance Issues
4481,SQL Endpoint not starting 
4482,ARR - AT&T - 2203180040005316 - Downgrade python version
4483, Security concerns of accessing Azure Key Vault Secrets via Azure Databricks Scopes using SparkSQL
4484,Whitelist ipaddres in Access list for feature store
4485,2754134964726624 - 81b4ec93-f52f-4194-9ad9-57e636bcd0b6 - 2203180040005316
4486,Spark job reading a parquet file from a delta table failed with Connection reset error
4487,git version
4488,Jobs Failure
4489,Spark questions
4490,Can't create external Hive table
4491,workspace API errors in /api/2.0/jobs/runs/get
4492,job that usually takes minutes to run got stuck for more than one day
4493,ARR | Cluster failed due to driver unhealthy error | 2203150040007744
4494,Performance issues
4495,"'schema = clean_schema_creator(inputFilePath, inputFileExtension)' is not working with Standard or High concurrency clusters"
4496,6148774466112347 | Job performance
4497,databricks jobs executed from ADF stuck 
4498,Databricks library conflicts
4499,Library issue
4500,Error : node stack overflow
4501,Databricks Scope Limit reached
4502,Cluster Permission Issue
4503,Databricks integration with Gitlab
4504,Cluster Creation Faioling
4505,Not able to read data from dedicated SQL Pool - When Ran from Databricks
4506,Cluster Upsizing Issue
4507,ARR | Standard Chartered Bank | JupyterDash cannot be displayed in databricks notebook| SR:2203090030001237
4508,Clarification on Databricks Managed Service Encryption & Access
4509,Can we use Prometheus Natively for monitoring the Apache Spark Cluster and Jobs running inside the Databricks
4510,Needed help in setting up Delta Sharing for this cluster
4511,Connect databrick work space with azure SQL managed Instance through JDBC.
4512,how to add service principal instead of using SCIM Rest api
4513,2203160010001296 | ARR | T-Mobile USA | .table function stopped working 
4514,need suggestion for SSO connection of auzre db
4515,Intermittent error with create or replace
4516,Can't connect to AWS MSK through Spark
4517,ADLS Error Faced in UDPCHI Production Job
4518,Databricks Notebook activity failing in pipeline- Saved
4519,22/03/15 23:21:10 ERROR RetryingHMSHandler: NoSuchObjectException(message:There is no database named global_temp)
4520,5281248367228789
4521, Rerouting cluster logs to adls gen2
4522,NPIP Issue on Cluster Creation in new E2 environment
4523,[ARR]SR#2203170060001083 connection issue of ADB to ADLS Gen 2
4524,[Microsoft][Hardy] (34) Error from server: SSL_connect: wrong version
4525,Notebook fails scala.Predef$.refArrayOps([Ljava/lang/Object;)Lscala/collection/mutable/ArrayOps;
4526,databricks privatelink
4527,Intermittent error:  Transport endpoint is not connected:
4528,SQL Analytics - Instance Profile Limitation
4529,Schemas created in a centralised external metastore are not shown consistently across Azure Databaricks workspace
4530,Creating live updating dashboard in databricks
4531,Spark write parquet operation is producing duplicate files 
4532,"Under 9.1 LTS ""sqlContext.sql()"" causes scheduled jobs to be timed out"
4533,Error breaking out streaming job
4534,Job terminated due to executor termination
4535,User Permission Issue
4536,ARR | 2203170040005277 | Bootstrap timeout in EastUS2 in 2 subscriptions of AT&T
4537,129372011637026 - 42c0910c-ba8d-4218-96f2-e8bbcfdb8dc0 - 2203040040004381
4538,Bug in the Databricks cluster UI
4539,ATT: Ingest1
4540,Add contacts
4541,Dropping delta table does not clean up S3 bucket folder
4542,ARR | Inquiry Regarding GPU Usage On Databricks Cluster over period of time 2/8 - 2/14 | 2203140040008801
4543,connecting to minio AND dxdl via custom broker 
4544,All purpose cluster hangs when mutiple jobs are submitted against the cluster
4545,AWS Workspace access for Quan Ta
4546,Photon ran out of memory error while switching from DBFS to ADLS
4547,ARR  | Job aborted due to stage failure - 2203170030001735
4548,Change Feature Store table permission
4549,Unable to Configure IP Access List
4550,ARR | 2202180040005938 | Follow up to 00135021
4551,ATT: Ingest1
4552,SparkException SQL statement error in Databricks
4553,Cannot execute SQL statements to the Metastore
4554,Databricks Job Performance degraded post databricks upgrade from 6.4 to 9.1
4555,IllegalArgumentException when calling dataframe.count()
4556,DB SQL erroring on query. Query works on notebook.
4557,connection between RDS and Databricks is not working
4558,Getting SECURITY_DAEMON_REGISTRATION_EXCEPTION
4559,Drastic Execution Time Increase when upgrading 10.1 -> 10.3 DBRuntime
4560,2203030050001416 - Automate the creation of Azure KeyVault-based secret-scope via Service Principal
4561,Preventing creation of _started and _committed files
4562,Notebooks intermittently gray and un-selectable for user 
4563,ARR | PAT token permission | 2203170050001235
4564,Getting unauthorized error from CLI after turning on IP Access list
4565,2203170040005277 | Cluster Failure
4566,"2203160050000289 Caused by SSLError(SSLEOFError(8, 'EOF occurred in violation of protocol (_ssl.c:1131)'))"
4567,how to add a spark conf for all clusters in my workspace
4568,"Data getting rejected, going into _corrupted_record"
4569,ARR:Follow up 00137469:Scanning failing for part of the assets (hive metastore as a source):SR 2201280040004720
4570,ARR Customer: Cummins - Customer uses reserved Databricks DBU instances which are purchased ahead of time. He has tagged objects in his workspaces but the tags are not propagating properly when they run cost calculations. 
4571,Streaming query Exception : exception thrown awaitResult
4572,Streaming query Exception : exception thrown awaitResult
4573,upgrading cluster makes current_date fail 
4574,How to migrate Local hive to external hive in local mode
4575,Databricks Job failure due to “org.apache.spark.SparkException: Job aborted” occasionally
4576,Data drop on the xpopd data service
4577,Databricks Job - Structured Streaming
4578,VPC requirements having Transit gateway 
4579,Require new IP whitelisted
4580,Databricks Job
4581,Facing issue while running MLFLOW model using UDF on worker node.
4582,Databricks
4583,Degraded performance of SQL vs Pyspark
4584,Cluster issue
4585,Streaming query Exception : exception thrown awaitResult
4586,CSS-ARR-SR#2203160030000641 Not able to use scheme registry
4587,Streaming the Eventhub data is verysloe and not producing any results
4588,2203170030001547 
4589,Issue while parsing csv in databricks
4590,Availability of Graviton R6g instances
4591,Unable to enable SSO in the Databricks Admin Console
4592,Databricks Job Hanging Tasks
4593,Need help from Databricks Team - 2203090030002266
4594,Follow up of 00134523
4595,reset password email not received (qlik-rct@greenflex.com)
4596,Unable to Mount QA Storage to Databricks
4597,Questions on Credential Passthrough clusters
4598,[ERROR] databrick notebook - plotly - dash 
4599,encoding parsing issue
4600,Mixed privilege access to S3 bucket mount
4601,Plotly Mapbox plots are displayed
4602,"While writing data from databricks into ADLS files , storage ACL permission (Mask bit) is not inheriting properly"
4603,Issue while parsing csv in databricks
4604,"ARR | 2203170030000772 | Databricks Subnet Exhausted Error | Safeway, Inc."
4605,IMDSv2 enforcement
4606,Library issue in Databricks clusters
4607, Need to increase quota
4608,Multiple jobs stuck in pending state
4609,Databricks Job - Structured Streaming
4610,location is not accessble in Privesera cluster
4611,ARR |  The Dow Chemical Company |Delta live table enabling | SR: 2203170060000434|
4612,jobs are failing intermitantly 
4613,wrong permissions when writing to mounted s3 bucket
4614,ARR- Azure Databricks Production Cluster terminated.Reason:Bootstrap Timeout- 2203170040000405
4615,Inquiry on why DBFS was unmounted
